{"$schema":"https://json-schema.org/draft/2020-12/schema","type":"object","required":["published_at","probability_pct","triggered","available","signals"],"properties":{"published_at":{"type":"string"},"probability_pct":{"type":["number","null"],"minimum":0,"maximum":100},"triggered":{"type":"integer"},"available":{"type":"integer"},"signals":{"type":"array","items":{"type":"object","required":["name","code","rule","value","triggered"],"properties":{"name":{"type":"string"},"code":{"type":"string"},"rule":{"type":"string"},"value":{"type":["number","null"]},"op": {"enum": [">=", ">", "<"]}, "threshold": {"type": "number"}, "triggered":{"type":["boolean","null"]}}}}}}
