{
  "published_at": "2026-10-19T12:56:43Z",
  "probability_pct": 0.0,
  "triggered": 0,
  "available": 6,
  "signals": [
    {
      "name": "Sahm",
      "code": "SAHMREALTIME",
      "rule": ">= +0.50pp",
      "value": 0.0,
      "as_of": "2026-09-01",
      "op": ">=",
      "threshold": 0.5,
      "triggered": false
    },
    {
      "name": "10Y\u20133M",
      "code": "T10Y3M",
      "rule": "< 0",
      "value": 0.83,
      "as_of": "2026-10-16",
      "op": "<",
      "threshold": 0.0,
      "triggered": false
    },
    {
      "name": "NFCI",
      "code": "NFCI",
      "rule": "> 0",
      "value": -0.499,
      "as_of": "2026-10-09",
      "op": ">",
      "threshold": 0.0,
      "triggered": false
    },
    {
      "name": "Claims",
      "code": "ICSA",
      "rule": "13-week avg > 110% of 52-week avg",
      "value": 95.0,
      "as_of": "2026-10-10",
      "op": ">",
      "threshold": 110.0,
      "triggered": false
    },
    {
      "name": "CFNAI",
      "code": "CFNAIMA3",
      "rule": "< -0.70",
      "value": 0.01,
      "as_of": "2026-08-01",
      "op": "<",
      "threshold": -0.7,
      "triggered": false
    },
    {
      "name": "Chauvet-Piger",
      "code": "RECPROUSM156N",
      "rule": "> 20%",
      "value": 0.62,
      "as_of": "2026-08-01",
      "op": ">",
      "threshold": 20.0,
      "triggered": false
    }
  ]
}
